{
  "$schema": "https://json-schema.org/draft/2020-12/schema",
  "$id": "urn:ai-marketing-hub:claude-ads:schema:control:v1:vulnerability-exceptions.v1.json",
  "title": "Claude Ads vulnerability not-affected evidence",
  "type": "object",
  "additionalProperties": false,
  "required": ["schema_version", "generated_at", "expires_at", "policy", "code_scope", "exceptions"],
  "properties": {
    "schema_version": {"const": "1.0.0"},
    "generated_at": {"type": "string", "format": "date"},
    "expires_at": {"type": "string", "format": "date"},
    "policy": {"const": "Only time-bounded not_affected dispositions are allowed. Accepted risk is not represented here. Any package, version, advisory, import, execution-path, or expiry drift fails closed."},
    "code_scope": {
      "type": "array",
      "minItems": 1,
      "uniqueItems": true,
      "items": {"type": "string", "pattern": "^(?!/)(?!.*(?:^|/)\\.\\.?(?:/|$))[a-zA-Z0-9_./-]+$"}
    },
    "exceptions": {
      "type": "array",
      "minItems": 1,
      "items": {"$ref": "#/$defs/exception"}
    }
  },
  "$defs": {
    "exception": {
      "type": "object",
      "additionalProperties": false,
      "required": ["advisory_id", "aliases", "advisory_url", "package", "affected_version", "fixed_versions", "status", "justification", "analysis", "evidence_paths", "forbidden_import_prefixes", "verified_at", "expires_at", "owner"],
      "properties": {
        "advisory_id": {"type": "string", "pattern": "^PYSEC-[0-9]{4}-[0-9]+$"},
        "aliases": {"type": "array", "minItems": 1, "uniqueItems": true, "items": {"type": "string", "minLength": 1}},
        "advisory_url": {"type": "string", "pattern": "^https://github.com/.+/security/advisories/GHSA-"},
        "package": {"enum": ["cryptography", "pillow"]},
        "affected_version": {"type": "string", "minLength": 1},
        "fixed_versions": {"type": "array", "minItems": 1, "uniqueItems": true, "items": {"type": "string", "minLength": 1}},
        "status": {"const": "not_affected"},
        "justification": {"const": "vulnerable_code_not_in_execute_path"},
        "analysis": {"type": "string", "minLength": 20},
        "evidence_paths": {"type": "array", "minItems": 1, "uniqueItems": true, "items": {"type": "string", "pattern": "^(?!/)(?!.*(?:^|/)\\.\\.?(?:/|$))[a-zA-Z0-9_./-]+$"}},
        "forbidden_import_prefixes": {"type": "array", "minItems": 1, "uniqueItems": true, "items": {"type": "string", "pattern": "^[a-zA-Z0-9_.]+$"}},
        "verified_at": {"type": "string", "format": "date"},
        "expires_at": {"type": "string", "format": "date"},
        "owner": {"const": "security-owner"}
      }
    }
  }
}
