{
  "code_scope": [
    "claude_ads_core",
    "evals",
    "scripts"
  ],
  "exceptions": [
    {
      "advisory_id": "PYSEC-2026-3552",
      "advisory_url": "https://github.com/pyca/cryptography/security/advisories/GHSA-g6cj-pr64-35w5",
      "affected_version": "48.0.1",
      "aliases": [
        "CVE-2026-69247",
        "GHSA-g6cj-pr64-35w5"
      ],
      "analysis": "The vulnerable PKCS7 decryption APIs are not imported or called. Product code uses cryptography only for Ed25519 signature verification and InvalidSignature handling.",
      "evidence_paths": [
        "evals/model_evidence_auth.py",
        "scripts/review_evidence.py",
        "scripts/url_utils.py"
      ],
      "expires_at": "2026-11-06",
      "fixed_versions": [
        "50.0.0"
      ],
      "forbidden_import_prefixes": [
        "cryptography.hazmat.primitives.serialization.pkcs7"
      ],
      "justification": "vulnerable_code_not_in_execute_path",
      "owner": "security-owner",
      "package": "cryptography",
      "status": "not_affected",
      "verified_at": "2026-10-07"
    },
    {
      "advisory_id": "PYSEC-2026-3553",
      "advisory_url": "https://github.com/pyca/cryptography/security/advisories/GHSA-jwv3-5hgf-82ww",
      "affected_version": "48.0.1",
      "aliases": [
        "CVE-2026-69249",
        "GHSA-jwv3-5hgf-82ww"
      ],
      "analysis": "The publisher advisory defines the affected range as <=48.0.0 and the patched range as >=49.0.0, so locked cryptography 48.0.1 is outside the publisher-affected range even though pip-audit reports PYSEC-2026-3553 against 48.0.1. The conservative cryptography.x509 import guard remains time-bounded because the scanner and publisher ranges disagree; product code uses cryptography only for Ed25519 signature verification and InvalidSignature handling.",
      "evidence_paths": [
        "evals/model_evidence_auth.py",
        "scripts/review_evidence.py",
        "scripts/url_utils.py"
      ],
      "expires_at": "2026-11-06",
      "fixed_versions": [
        "49.0.0"
      ],
      "forbidden_import_prefixes": [
        "cryptography.x509"
      ],
      "justification": "vulnerable_code_not_in_execute_path",
      "owner": "security-owner",
      "package": "cryptography",
      "status": "not_affected",
      "verified_at": "2026-10-07"
    },
    {
      "advisory_id": "PYSEC-2026-3554",
      "advisory_url": "https://github.com/pyca/cryptography/security/advisories/GHSA-m2h6-j472-rp4c",
      "affected_version": "48.0.1",
      "aliases": [
        "CVE-2026-69248",
        "GHSA-m2h6-j472-rp4c"
      ],
      "analysis": "The publisher advisory defines the affected range as <=48.0.0 and the patched range as >=49.0.0, so locked cryptography 48.0.1 is outside the publisher-affected range even though pip-audit reports PYSEC-2026-3554 against 48.0.1. The conservative cryptography.x509 import guard remains time-bounded because the scanner and publisher ranges disagree; product code uses cryptography only for Ed25519 signature verification and InvalidSignature handling.",
      "evidence_paths": [
        "evals/model_evidence_auth.py",
        "scripts/review_evidence.py",
        "scripts/url_utils.py"
      ],
      "expires_at": "2026-11-06",
      "fixed_versions": [
        "49.0.0"
      ],
      "forbidden_import_prefixes": [
        "cryptography.x509"
      ],
      "justification": "vulnerable_code_not_in_execute_path",
      "owner": "security-owner",
      "package": "cryptography",
      "status": "not_affected",
      "verified_at": "2026-10-07"
    }
  ],
  "expires_at": "2026-11-06",
  "generated_at": "2026-10-07",
  "policy": "Only time-bounded not_affected dispositions are allowed. Accepted risk is not represented here. Any package, version, advisory, import, execution-path, or expiry drift fails closed.",
  "schema_version": "1.0.0"
}
